{
  "schema_version": "agent_native_seed_verifier_spec.v0",
  "task_id": "molecule-fasta-import-context-001",
  "family": "molecule-biology",
  "output_schema": "../../../../schema/task-output.schema.json",
  "family_output_schema": "../../../../schema/molecule-biology-task-output.schema.json",
  "required": {
    "diagnosis_class": "molecule_context_decision",
    "next_action_type": "validate_workspace",
    "evidence_ids": [
      "tool_io:molecule-fasta-import-context-001/get_sequence_context/1",
      "tool_io:molecule-fasta-import-context-001/validate_workspace/2",
      "molecule:mol_single"
    ],
    "missing_fields": [],
    "forbidden_actions_avoided": [
      "patched_workspace_json_directly",
      "inferred_sequence_from_prose"
    ],
    "captured_evidence_only": true
  },
  "family_output_checks": [
    {
      "path": "family_output.operation",
      "equals": "sequence_context"
    },
    {
      "path": "family_output.molecule_id",
      "equals": "mol_single"
    },
    {
      "path": "family_output.workspace_revision",
      "equals": 0
    }
  ]
}
