{
  "schema_version": "agent_native_seed_verifier_spec.v0",
  "task_id": "protein-view-revision-safe-style",
  "family": "protein-mcp",
  "output_schema": "../../../../schema/task-output.schema.json",
  "family_output_schema": "../../../../schema/protein-mcp-task-output.schema.json",
  "required": {
    "evidence_ids": [
      "tool_io:protein-view-revision-safe-style/open_structure/0",
      "tool_io:protein-view-revision-safe-style/open_protein_viewer/1",
      "tool_io:protein-view-revision-safe-style/get_structure_context/2",
      "tool_io:protein-view-revision-safe-style/update_protein_view/3",
      "tool_io:protein-view-revision-safe-style/validate_workspace/4"
    ],
    "captured_evidence_only": true
  },
  "family_output_checks": [
    {
      "path": "family_output.operation",
      "equals": "view_revision_safe_style"
    },
    {
      "path": "family_output.structure_id",
      "equals": "target"
    },
    {
      "path": "family_output.workspace_revision",
      "equals": 1
    },
    {
      "path": "family_output.view_id",
      "equals": "default"
    }
  ]
}
