{
  "schema_version": "agent_native_seed_verifier_spec.v0",
  "task_id": "molecule-primer-validation-001",
  "family": "molecule-biology",
  "output_schema": "../../../../schema/task-output.schema.json",
  "family_output_schema": "../../../../schema/molecule-biology-task-output.schema.json",
  "required": {
    "diagnosis_class": "molecule_primer_decision",
    "next_action_type": "upsert_primer",
    "evidence_ids": [
      "tool_io:molecule-primer-validation-001/get_sequence_context/1",
      "tool_io:molecule-primer-validation-001/upsert_primer/2",
      "tool_io:molecule-primer-validation-001/validate_workspace/3",
      "molecule:mol_circular",
      "primer:primer_seed_fwd"
    ],
    "missing_fields": [],
    "forbidden_actions_avoided": [
      "patched_workspace_json_directly",
      "inferred_sequence_from_prose"
    ],
    "captured_evidence_only": true
  },
  "family_output_checks": [
    {
      "path": "family_output.operation",
      "equals": "primer_validation"
    },
    {
      "path": "family_output.molecule_id",
      "equals": "mol_circular"
    },
    {
      "path": "family_output.workspace_revision",
      "equals": 1
    },
    {
      "path": "family_output.primer_ids",
      "contains_all": [
        "primer_seed_fwd"
      ]
    }
  ]
}
